{
  "$schema": "https://json-schema.org/draft/2020-12/schema",
  "$id": "https://yomineko.dev/contracts/lesson.schema.json",
  "title": "lesson",
  "description": "The leaf unit a learner sits down to. Holds objectives, explanation, exercises and the items it introduces — all corpus content by REFERENCE, never embedded.",
  "x-yomineko": {
    "entity": "lesson",
    "records": 322,
    "packing": "single",
    "glob": "course/*/topic-*/lesson-*.json",
    "stable_id_field": "id",
    "generated_by": "scripts/contracts/build_schemas.py from contracts/_shapes.json",
    "vocabulary_policy": "Types, nesting and `required` are measured from the data. Value sets are not: every `enum` here is either declared in a design document, parsed from the code that produces the value, or curated in build_schemas.py with its source named in x-vocabulary. See contracts/README.md."
  },
  "type": "object",
  "properties": {
    "body": {
      "type": "string"
    },
    "cumulative_known_set": {
      "type": "object",
      "properties": {
        "conjugation-form": {
          "type": "array",
          "items": {
            "type": "string"
          }
        },
        "grammar": {
          "type": "array",
          "items": {
            "type": "string"
          }
        },
        "kana-family": {
          "type": "array",
          "items": {
            "type": "string"
          }
        },
        "kanji": {
          "type": "array",
          "items": {
            "type": "string"
          }
        },
        "phrase": {
          "type": "array"
        },
        "vocab": {
          "type": "array",
          "items": {
            "type": "string"
          }
        }
      },
      "required": [
        "conjugation-form",
        "grammar",
        "kana-family",
        "kanji",
        "phrase",
        "vocab"
      ],
      "additionalProperties": false
    },
    "description": {
      "$ref": "common.schema.json#/$defs/LocaleText"
    },
    "exercises": {
      "type": "array",
      "items": {
        "type": "object",
        "properties": {
          "answer": {
            "type": "object",
            "properties": {
              "accept": {
                "type": "array"
              },
              "choices": {
                "type": "array"
              },
              "correct": {
                "type": "string"
              },
              "full": {
                "type": "string"
              },
              "order": {
                "type": "array"
              },
              "pairs": {
                "type": "array"
              },
              "sentence_refs": {
                "type": "array"
              },
              "text": {
                "type": "string"
              }
            }
          },
          "explanation": {
            "$ref": "common.schema.json#/$defs/LocaleText"
          },
          "id": {
            "$ref": "common.schema.json#/$defs/StableId"
          },
          "prompt": {
            "$ref": "common.schema.json#/$defs/LocaleText"
          },
          "sentence_refs": {
            "type": "array",
            "items": {
              "type": "string"
            }
          },
          "type": {
            "type": "string",
            "enum": [
              "cloze",
              "handwriting",
              "listening",
              "matching",
              "ordering",
              "particle_choice",
              "production",
              "reading",
              "recognition",
              "sentence_build"
            ],
            "description": "What kind of exercise this is. Vocabulary owner: design — design/lesson_schema.md ('Exercise records', the ten `type` values). Widening it is an edit there, never a side effect of regenerating this schema from the data.",
            "x-vocabulary": {
              "owner": "design",
              "source": "design/lesson_schema.md ('Exercise records', the ten `type` values)"
            }
          }
        },
        "additionalProperties": false
      }
    },
    "feature_unlocks": {
      "type": "array",
      "items": {
        "type": "string",
        "enum": [
          "feat:conjugation-drill",
          "feat:find-correct-kanji",
          "feat:find-correct-particle",
          "feat:furigana-toggle",
          "feat:handwriting-input",
          "feat:jlpt-sim-n3",
          "feat:jlpt-sim-n4",
          "feat:jlpt-sim-n5",
          "feat:kana-input",
          "feat:kanji-lookup",
          "feat:listening",
          "feat:particle-drill",
          "feat:phrase-builder",
          "feat:romaji-toggle",
          "feat:srs-reviews",
          "feat:visual-novel",
          "feat:voice-mode"
        ],
        "description": "An app feature this lesson turns on. Vocabulary owner: design — design/unlock_enums.json#feature. Widening it is an edit there, never a side effect of regenerating this schema from the data.",
        "x-vocabulary": {
          "owner": "design",
          "source": "design/unlock_enums.json#feature"
        }
      }
    },
    "id": {
      "$ref": "common.schema.json#/$defs/StableId"
    },
    "level": {
      "$ref": "common.schema.json#/$defs/Level"
    },
    "needs": {
      "type": "array",
      "items": {
        "type": "object",
        "properties": {
          "note": {
            "type": "string"
          },
          "ref": {
            "type": "string"
          },
          "type": {
            "type": "string",
            "enum": [
              "lesson"
            ],
            "x-vocabulary": {
              "owner": "measured",
              "source": "contracts/_shapes.json — no design document or producer owns this field, and the observed set is small, closed and free of prose, ids and paths."
            }
          }
        },
        "additionalProperties": false
      }
    },
    "needs_review": {
      "$ref": "common.schema.json#/$defs/Provenance/properties/needs_review"
    },
    "objectives": {
      "type": "array",
      "items": {
        "$ref": "common.schema.json#/$defs/LocaleText"
      }
    },
    "order": {
      "type": "integer",
      "minimum": 0
    },
    "review_status": {
      "type": "array",
      "description": "Human review verdicts that are still LIVE for this record: each one's content hash still matches the text it approved. Written by the exporter from research/derived/review_ledger.json, never by hand — an entry whose text was rewritten afterwards is stale and exports nothing, and a review_status the ledger does not justify is a hard failure (scripts/validate/validate_review_ledger.py). Absent on a record nobody has reviewed, which is why it is never required. See design/review_ledger.md.",
      "items": {
        "type": "object",
        "properties": {
          "field": {
            "type": "string",
            "minLength": 1,
            "description": "The reviewed field, or \"*\" for the whole record."
          },
          "locale": {
            "anyOf": [
              {
                "$ref": "common.schema.json#/$defs/Locale"
              },
              {
                "type": "null"
              }
            ],
            "description": "The locale reviewed; null for a locale-agnostic verdict."
          },
          "status": {
            "type": "string",
            "enum": [
              "approved",
              "rejected"
            ],
            "description": "The verdict a named reviewer recorded. Vocabulary owner: design — design/review_ledger.md. Widening it is an edit there, never a side effect of regenerating this schema from the data.",
            "x-vocabulary": {
              "owner": "design",
              "source": "design/review_ledger.md"
            }
          },
          "reviewed_by": {
            "type": "string",
            "minLength": 1,
            "description": "Who reviewed it. An anonymous approval is not a review, and the correction-rate metric is per person."
          },
          "approved_at": {
            "type": "string",
            "minLength": 1,
            "description": "When. Provenance and ordering only — approvals do not expire (APP_PLAN D4): a rewrite invalidates them, the calendar does not."
          },
          "content_hash": {
            "type": "string",
            "pattern": "^(sha256:)?[0-9a-fA-F]{8,64}$",
            "description": "The sha256 of exactly what was reviewed, so a reader can tell WHICH text was approved without the ledger."
          }
        },
        "required": [
          "field",
          "status",
          "reviewed_by",
          "approved_at",
          "content_hash"
        ],
        "additionalProperties": false
      }
    },
    "schema_version": {
      "type": "string",
      "pattern": "^\\d+\\.\\d+$",
      "description": "MAJOR.MINOR of the record format. A version field exists to be bumped; an enum over the current value means it never can be."
    },
    "sentence_refs": {
      "type": "array",
      "items": {
        "type": "string"
      }
    },
    "srs": {
      "type": "object",
      "properties": {
        "introduces_cards": {
          "type": "array",
          "items": {
            "type": "object",
            "properties": {
              "card_types": {
                "type": "array"
              },
              "deck": {
                "type": "string",
                "enum": [
                  "deck:grammar-n3",
                  "deck:grammar-n4",
                  "deck:grammar-n5",
                  "deck:kana-hiragana",
                  "deck:kana-katakana",
                  "deck:kanji-n3",
                  "deck:kanji-n4",
                  "deck:kanji-n5",
                  "deck:phrases",
                  "deck:vocab-n3",
                  "deck:vocab-n4",
                  "deck:vocab-n5"
                ],
                "description": "The SRS deck these cards land in. Vocabulary owner: design — design/unlock_enums.json#deck. Widening it is an edit there, never a side effect of regenerating this schema from the data.",
                "x-vocabulary": {
                  "owner": "design",
                  "source": "design/unlock_enums.json#deck"
                }
              },
              "example": {
                "type": "object",
                "description": "The example sentence this card shows its item in, and the cloze span over it. Selected from the bank by the lesson renderer's own display rule at the card's lesson (i+1 within the level budget, at or below the level), never authored. Optional by measurement: a card whose item no admissible sentence carries has none, and validate_card_content.py ratchets that count. See design/srs_design.md §9.",
                "properties": {
                  "sentence": {
                    "type": "string",
                    "pattern": "^sent:",
                    "description": "The bank sentence (corpus/sentences/bank.json slug)."
                  },
                  "cloze": {
                    "type": "object",
                    "description": "The span a cloze blanks: code-point offsets into the sentence's `jp`, on Sudachi token boundaries, covering the card's item (the word's whole inflected form, the grammar point's form, or the word that carries the kanji).",
                    "properties": {
                      "start": {
                        "type": "integer",
                        "minimum": 0
                      },
                      "end": {
                        "type": "integer",
                        "minimum": 1
                      },
                      "answer": {
                        "type": "string",
                        "minLength": 1,
                        "description": "`jp[start:end]`, stored so a drifted sentence is caught instead of blanking the wrong characters. Japanese, locale-invariant."
                      }
                    },
                    "required": [
                      "start",
                      "end",
                      "answer"
                    ],
                    "additionalProperties": false
                  }
                },
                "required": [
                  "sentence",
                  "cloze"
                ],
                "additionalProperties": false
              },
              "item": {
                "type": "string"
              },
              "production_key": {
                "type": "object",
                "description": "The answer key for a `production` card: what the learner is asked and what a grader must accept. Present only on production cards: the 2,951 vocabulary ones (authored) and the 211 kana glyph ones (W29, derived by template from the Layer-A kana record); grammar and kanji production cards are later work, which is why this is optional by measurement rather than by exception. The card SET comes from the unlock ledger, the card's CONTENT does not. See design/srs_design.md §8 and scripts/validate/validate_card_content.py.",
                "properties": {
                  "prompt": {
                    "$ref": "common.schema.json#/$defs/LocaleText",
                    "description": "What the learner is shown. A locale object, never a bare `prompt_pt`: design/i18n.md records the PT-suffixed bare string on speak_unit as a contract violation and this field must not repeat it."
                  },
                  "accept": {
                    "type": "array",
                    "items": {
                      "type": "string",
                      "minLength": 1
                    },
                    "uniqueItems": true,
                    "minItems": 1,
                    "description": "Every Japanese surface a grader must take as correct: the record's headword, its common kanji variants and its kana, minus the forms JMdict tags rare, out-dated, search-only or irregular (a learner typing み for \"mar\" used to be marked right). A bare array, not a locale object: Japanese here is the material under test, so it is locale-invariant — the same ruling design/i18n.md gives exam_item.answer. It states WHICH surfaces are correct and nothing about how the app normalises what was typed."
                  },
                  "sense_index": {
                    "type": "integer",
                    "minimum": 0,
                    "description": "Which senses[] entry of the item the prompt glosses, so a reviewer can check the cue against the record rather than against memory."
                  },
                  "verified": {
                    "type": "string",
                    "enum": [
                      "sampled",
                      "derived"
                    ],
                    "description": "How the key was checked. `sampled` is a claim about the TABLE — one verifier per batch at authoring time, then a random sample read against the records before apply (APP_PLAN §1 \"verify once\") — never a claim that a human read this row. `derived` (W29, kana) means no author and no sample: a deterministic template substitution over Layer-A records, checked by the card-content gate.",
                    "x-vocabulary": {
                      "owner": "design",
                      "source": "design/srs_design.md#8"
                    }
                  },
                  "verified_by": {
                    "type": "string",
                    "minLength": 1,
                    "description": "The report carrying the evidence for `verified`."
                  }
                },
                "required": [
                  "prompt",
                  "accept",
                  "verified",
                  "verified_by"
                ],
                "additionalProperties": false
              }
            }
          }
        }
      },
      "required": [
        "introduces_cards"
      ],
      "additionalProperties": false
    },
    "title": {
      "$ref": "common.schema.json#/$defs/LocaleText"
    },
    "topic": {
      "type": "string"
    },
    "unlocks": {
      "type": "array",
      "items": {
        "type": "object",
        "properties": {
          "ref": {
            "type": "string"
          },
          "type": {
            "type": "string",
            "enum": [
              "conjugation-form",
              "feature",
              "grammar",
              "kana-family",
              "kanji",
              "kanji-family",
              "phrase",
              "srs-deck",
              "vocab"
            ],
            "description": "What kind of item this lesson makes available. Vocabulary owner: design — design/unlock_enums.json#unlock_type. Widening it is an edit there, never a side effect of regenerating this schema from the data.",
            "x-vocabulary": {
              "owner": "design",
              "source": "design/unlock_enums.json#unlock_type"
            }
          }
        },
        "additionalProperties": false
      }
    }
  },
  "additionalProperties": false,
  "required": [
    "body",
    "cumulative_known_set",
    "description",
    "exercises",
    "feature_unlocks",
    "id",
    "level",
    "needs",
    "needs_review",
    "objectives",
    "order",
    "schema_version",
    "sentence_refs",
    "srs",
    "title",
    "topic",
    "unlocks"
  ]
}
