{
  "id": "les:n3-limites-01",
  "schema_version": "1.0",
  "level": "n3",
  "topic": "top:n3-limites",
  "order": 1,
  "title": {
    "pt-BR": "Cerca de, a ponto de e o sufixo de grau さ"
  },
  "description": {
    "pt-BR": "Você aprende a medir quantidade e intensidade com くらい/ぐらい, a cobrar um patamar mínimo com くらいは～ない e a transformar adjetivos em substantivos de grau com o sufixo さ."
  },
  "objectives": [
    {
      "pt-BR": "Usar くらい/ぐらい para indicar quantidade aproximada e grau ('a ponto de')"
    },
    {
      "pt-BR": "Cobrar um mínimo razoável com a estrutura くらいは～ない"
    },
    {
      "pt-BR": "Formar substantivos de grau a partir de adjetivos com o sufixo さ"
    },
    {
      "pt-BR": "Reconhecer e ler o vocabulário de medida, limite e resultado deste bloco"
    }
  ],
  "needs": [],
  "unlocks": [
    {
      "type": "grammar",
      "ref": "gram:n3-kurai"
    },
    {
      "type": "grammar",
      "ref": "gram:n3-kurai-wa-nai"
    },
    {
      "type": "grammar",
      "ref": "gram:n3-sa"
    },
    {
      "type": "kanji",
      "ref": "kanji:具"
    },
    {
      "type": "kanji",
      "ref": "kanji:単"
    },
    {
      "type": "kanji",
      "ref": "kanji:号"
    },
    {
      "type": "kanji",
      "ref": "kanji:園"
    },
    {
      "type": "kanji",
      "ref": "kanji:易"
    },
    {
      "type": "kanji",
      "ref": "kanji:辞"
    },
    {
      "type": "kanji",
      "ref": "kanji:速"
    },
    {
      "type": "vocab",
      "ref": "vocab:ケース"
    },
    {
      "type": "vocab",
      "ref": "vocab:ゲーム"
    },
    {
      "type": "vocab",
      "ref": "vocab:傾向"
    },
    {
      "type": "vocab",
      "ref": "vocab:刑事"
    },
    {
      "type": "vocab",
      "ref": "vocab:劇"
    },
    {
      "type": "vocab",
      "ref": "vocab:劇場"
    },
    {
      "type": "vocab",
      "ref": "vocab:化粧"
    },
    {
      "type": "vocab",
      "ref": "vocab:契約"
    },
    {
      "type": "vocab",
      "ref": "vocab:掲示"
    },
    {
      "type": "vocab",
      "ref": "vocab:経由"
    },
    {
      "type": "vocab",
      "ref": "vocab:結果"
    },
    {
      "type": "vocab",
      "ref": "vocab:芸術"
    },
    {
      "type": "vocab",
      "ref": "vocab:計算"
    },
    {
      "type": "vocab",
      "ref": "vocab:警告"
    }
  ],
  "feature_unlocks": [],
  "srs": {
    "introduces_cards": [
      {
        "deck": "deck:grammar-n5",
        "item": "gram:n3-kurai",
        "card_types": [
          "recognition",
          "cloze",
          "production"
        ]
      },
      {
        "deck": "deck:grammar-n5",
        "item": "gram:n3-kurai-wa-nai",
        "card_types": [
          "recognition",
          "cloze",
          "production"
        ]
      },
      {
        "deck": "deck:grammar-n5",
        "item": "gram:n3-sa",
        "card_types": [
          "recognition",
          "cloze",
          "production"
        ]
      },
      {
        "deck": "deck:kanji-n5",
        "item": "kanji:具",
        "card_types": [
          "recognition",
          "production",
          "handwriting"
        ]
      },
      {
        "deck": "deck:kanji-n5",
        "item": "kanji:単",
        "card_types": [
          "recognition",
          "production",
          "handwriting"
        ]
      },
      {
        "deck": "deck:kanji-n5",
        "item": "kanji:号",
        "card_types": [
          "recognition",
          "production",
          "handwriting"
        ]
      },
      {
        "deck": "deck:kanji-n5",
        "item": "kanji:園",
        "card_types": [
          "recognition",
          "production",
          "handwriting"
        ]
      },
      {
        "deck": "deck:kanji-n5",
        "item": "kanji:易",
        "card_types": [
          "recognition",
          "production",
          "handwriting"
        ]
      },
      {
        "deck": "deck:kanji-n5",
        "item": "kanji:辞",
        "card_types": [
          "recognition",
          "production",
          "handwriting"
        ]
      },
      {
        "deck": "deck:kanji-n5",
        "item": "kanji:速",
        "card_types": [
          "recognition",
          "production",
          "handwriting"
        ]
      },
      {
        "deck": "deck:vocab-n5",
        "item": "vocab:ケース",
        "card_types": [
          "recognition",
          "production"
        ]
      },
      {
        "deck": "deck:vocab-n5",
        "item": "vocab:ゲーム",
        "card_types": [
          "recognition",
          "production"
        ]
      },
      {
        "deck": "deck:vocab-n5",
        "item": "vocab:傾向",
        "card_types": [
          "recognition",
          "production"
        ]
      },
      {
        "deck": "deck:vocab-n5",
        "item": "vocab:刑事",
        "card_types": [
          "recognition",
          "production"
        ]
      },
      {
        "deck": "deck:vocab-n5",
        "item": "vocab:劇",
        "card_types": [
          "recognition",
          "production"
        ]
      },
      {
        "deck": "deck:vocab-n5",
        "item": "vocab:劇場",
        "card_types": [
          "recognition",
          "production"
        ]
      },
      {
        "deck": "deck:vocab-n5",
        "item": "vocab:化粧",
        "card_types": [
          "recognition",
          "production"
        ]
      },
      {
        "deck": "deck:vocab-n5",
        "item": "vocab:契約",
        "card_types": [
          "recognition",
          "production"
        ]
      },
      {
        "deck": "deck:vocab-n5",
        "item": "vocab:掲示",
        "card_types": [
          "recognition",
          "production"
        ]
      },
      {
        "deck": "deck:vocab-n5",
        "item": "vocab:経由",
        "card_types": [
          "recognition",
          "production"
        ]
      },
      {
        "deck": "deck:vocab-n5",
        "item": "vocab:結果",
        "card_types": [
          "recognition",
          "production"
        ]
      },
      {
        "deck": "deck:vocab-n5",
        "item": "vocab:芸術",
        "card_types": [
          "recognition",
          "production"
        ]
      },
      {
        "deck": "deck:vocab-n5",
        "item": "vocab:計算",
        "card_types": [
          "recognition",
          "production"
        ]
      },
      {
        "deck": "deck:vocab-n5",
        "item": "vocab:警告",
        "card_types": [
          "recognition",
          "production"
        ]
      }
    ]
  },
  "cumulative_known_set": {
    "kana-family": [
      "kana:hiragana-a",
      "kana:hiragana-ka",
      "kana:hiragana-sa",
      "kana:hiragana-ta",
      "kana:hiragana-na",
      "kana:hiragana-ha",
      "kana:hiragana-ma",
      "kana:hiragana-ya",
      "kana:hiragana-ra",
      "kana:hiragana-wa",
      "kana:hiragana-n",
      "kana:hiragana-ga",
      "kana:hiragana-za",
      "kana:hiragana-ba",
      "kana:hiragana-da",
      "kana:hiragana-pa",
      "kana:hiragana-cha",
      "kana:hiragana-hya",
      "kana:hiragana-kya",
      "kana:hiragana-nya",
      "kana:hiragana-sha",
      "kana:hiragana-bya",
      "kana:hiragana-gya",
      "kana:hiragana-ja",
      "kana:hiragana-mya",
      "kana:hiragana-pya",
      "kana:hiragana-rya",
      "kana:hiragana-sokuon",
      "kana:katakana-a",
      "kana:katakana-ka",
      "kana:katakana-sa",
      "kana:katakana-ta",
      "kana:katakana-na",
      "kana:katakana-ha",
      "kana:katakana-ma",
      "kana:katakana-ya",
      "kana:katakana-ra",
      "kana:katakana-wa",
      "kana:katakana-n",
      "kana:katakana-ga",
      "kana:katakana-za",
      "kana:katakana-ba",
      "kana:katakana-da",
      "kana:katakana-pa",
      "kana:katakana-cha",
      "kana:katakana-hya",
      "kana:katakana-kya",
      "kana:katakana-nya",
      "kana:katakana-sha",
      "kana:katakana-bya",
      "kana:katakana-chouon",
      "kana:katakana-gya",
      "kana:katakana-ja",
      "kana:katakana-mya",
      "kana:katakana-pya",
      "kana:katakana-rya",
      "kana:katakana-sokuon"
    ],
    "vocab": [
      "vocab:さあ",
      "vocab:では",
      "vocab:どうも",
      "vocab:もう一度",
      "vocab:もしもし",
      "vocab:一寸",
      "vocab:下さい",
      "vocab:御座います",
      "vocab:あっ",
      "vocab:いいえ",
      "vocab:ええ",
      "vocab:そんな",
      "vocab:もう",
      "vocab:其れでは",
      "vocab:嗚呼",
      "vocab:成る程",
      "vocab:其れから",
      "vocab:味噌",
      "vocab:女の子",
      "vocab:如何して",
      "vocab:就いて",
      "vocab:此れから",
      "vocab:男の子",
      "vocab:草",
      "vocab:お巡りさん",
      "vocab:お金",
      "vocab:会社",
      "vocab:円",
      "vocab:医者",
      "vocab:外国人",
      "vocab:女",
      "vocab:椅子",
      "vocab:歌",
      "vocab:男",
      "vocab:絵",
      "vocab:英語",
      "vocab:貴方",
      "vocab:鍵",
      "vocab:音楽",
      "vocab:お手洗い",
      "vocab:お風呂",
      "vocab:アパート",
      "vocab:エレベーター",
      "vocab:入り口",
      "vocab:家",
      "vocab:尾",
      "vocab:彼",
      "vocab:彼の",
      "vocab:彼処",
      "vocab:彼方",
      "vocab:池",
      "vocab:海",
      "vocab:犬",
      "vocab:色",
      "vocab:階段",
      "vocab:お弁当",
      "vocab:お腹",
      "vocab:お菓子",
      "vocab:上着",
      "vocab:何時",
      "vocab:内",
      "vocab:映画",
      "vocab:映画館",
      "vocab:朝ごはん",
      "vocab:足",
      "vocab:鉛筆",
      "vocab:雨",
      "vocab:頭",
      "vocab:顔",
      "vocab:飴",
      "vocab:５日",
      "vocab:お兄さん",
      "vocab:お姉さん",
      "vocab:お母さん",
      "vocab:お父さん",
      "vocab:兄",
      "vocab:叔父",
      "vocab:大きな",
      "vocab:妹",
      "vocab:姉",
      "vocab:弟",
      "vocab:お祖母さん",
      "vocab:お祖父さん",
      "vocab:奥さん",
      "vocab:交差点",
      "vocab:交番",
      "vocab:側",
      "vocab:公園",
      "vocab:北",
      "vocab:国",
      "vocab:川",
      "vocab:方",
      "vocab:此処",
      "vocab:玄関",
      "vocab:角",
      "vocab:銀行",
      "vocab:クラス",
      "vocab:傘",
      "vocab:兄弟",
      "vocab:学校",
      "vocab:学生",
      "vocab:家庭",
      "vocab:家族",
      "vocab:教室",
      "vocab:靴",
      "vocab:靴下",
      "vocab:鞄",